"47818","dissected","shape",,,"Having two or more component sectors or peripheral protrusions that are delimited by concavities in the surface or margin and that are not proximally distinct from the remainder of the whole.  The meanings of this term and its approximate synonyms sometimes have been supposed to differ according to the depth of the delimiting concavities relative to the midline or midpoint of the overall structure, and/or to the shape or proportions of the protusions or sectors; however, there has been little consistency in the applications of the various terms according to such distinctions, which are ones only of degree and are necessarily arbitrary in any case.  In general usage, these terms differ only indistinctly and connotatively: cleft, lobed (or lobate), parted (or partite) and segmented tend to connote fewer protrusions or sectors; lobate usually connotes as well a generally rounded shape; dissected tends to connote more numerous sectors that are elongate and angular.  See also cut (incised, lacerate, torn), laciniate (slashed).","shape",NULL,"1","5438212c-aa86-4d1d-94a4-62c780e23b8b"
"47819","dissected","shape",,,"Having two or more component sectors or peripheral protrusions that are delimited by concavities in the surface or margin and that are not proximally distinct from the remainder of the whole.  The meanings of this term and its approximate synonyms sometimes have been supposed to differ according to the depth of the delimiting concavities relative to the midline or midpoint of the overall structure, and/or to the shape or proportions of the protusions or sectors; however, there has been little consistency in the applications of the various terms according to such distinctions, which are ones only of degree and are necessarily arbitrary in any case.  In general usage, these terms differ only indistinctly and connotatively: cleft, lobed (or lobate), parted (or partite) and segmented tend to connote fewer protrusions or sectors; lobate usually connotes as well a generally rounded shape; dissected tends to connote more numerous sectors that are elongate and angular.  See also cut (incised, lacerate, torn), laciniate (slashed).","shape",NULL,"1","144f244d-44dd-4604-8d54-3f4dda80cd98"
"47820","dissepiment","STRUCTURE",,,"A wall or partition between adjacent locules of an ovary or fruit.","STRUCTURE",NULL,"0","978c1c40-4dee-4bb1-99f6-b2360d1b77b4"
"47821","distal","insertion",,,"Upon or associated with the portion of a structure farthest from its developmental origin.","shape","q","1","65371470-2751-4362-bc5a-aca94f1de4a6"
"47822","distal","position",,,"Upon or associated with the portion of a structure farthest from its developmental origin.","shape","q","1","3ce5c7d6-e7cd-465f-bdb2-732d1b96dad9"
"47823","distant","arrangement",,,"Disposed relatively far from one another along the axis.","arrangement",NULL,"1","dfc3c18d-c622-4f63-889a-8a6658f997aa"
"47824","distichous","arrangement",,,"Disposed in two ranks along the axis, the ranks opposite one another.","arrangement",NULL,"1","af9f7385-63d7-43a7-aabe-0c5fba371567"
"47825","distinct","fusion","equivalent structures",,"Not fused or joined with one another in any degree.","fusion",NULL,"1","1d793ef4-f701-4a90-8a32-f350f498d7bb"
"47826","diurnal","habit","flower",,"Opening during the daytime.","habit",NULL,"1","73184dd2-b95c-4ae7-930e-26a6885081cd"
"47827","divaricate","arrangement",,,"Strongly divergent.","arrangement",NULL,"1","7ef28624-b107-4e1f-b389-4f471a2d5478"
"47828","divergent","arrangement",,,"Directed at individually different angles from a common point or relatively limited zone of origin, thus farther apart distally than proximally.","arrangement",NULL,"1","0c3ecf59-e470-4bc0-8bbf-429291874086"
"47829","divided","shape",,,"Having two or more component sectors or peripheral protrusions that are delimited by concavities in the surface or margin and that are not proximally distinct from the remainder of the whole.  The meanings of this term and its approximate synonyms sometimes have been supposed to differ according to the depth of the delimiting concavities relative to the midline or midpoint of the overall structure, and/or to the shape or proportions of the protusions or sectors; however, there has been little consistency in the applications of the various terms according to such distinctions, which are ones only of degree and are necessarily arbitrary in any case.  In general usage, these terms differ only indistinctly and connotatively: cleft, lobed (or lobate), parted (or partite) and segmented tend to connote fewer protrusions or sectors; lobate usually connotes as well a generally rounded shape; dissected tends to connote more numerous sectors that are elongate and angular.  See also cut (incised, lacerate, torn), laciniate (slashed).","shape",NULL,"1","ae3c90c4-ad28-4681-9f08-cfc1d77c5a5a"
"47830","divided","shape",,,"Having two or more component sectors or peripheral protrusions that are delimited by concavities in the surface or margin and that are not proximally distinct from the remainder of the whole.  The meanings of this term and its approximate synonyms sometimes have been supposed to differ according to the depth of the delimiting concavities relative to the midline or midpoint of the overall structure, and/or to the shape or proportions of the protusions or sectors; however, there has been little consistency in the applications of the various terms according to such distinctions, which are ones only of degree and are necessarily arbitrary in any case.  In general usage, these terms differ only indistinctly and connotatively: cleft, lobed (or lobate), parted (or partite) and segmented tend to connote fewer protrusions or sectors; lobate usually connotes as well a generally rounded shape; dissected tends to connote more numerous sectors that are elongate and angular.  See also cut (incised, lacerate, torn), laciniate (slashed).","shape",NULL,"1","ad2efa48-911f-494a-b50f-29db010c3032"
"47831","division","STRUCTURE",,,"Any generally convex, major peripheral protrusion or component sector that is delimited by concavities in the surface or margin and that is not proximally distinct from the remainder of the whole.","STRUCTURE",NULL,"0","7477724b-6180-4fdf-8702-6ebe2938c42f"
"47832","dodeca_","prefix",,,"Indicating presence of or constitution by twelve entities of the type denoted by the term's stem; as in  dodecandrous, dodecalocular, dodecastylous.","prefix",NULL,"1","48526f74-b270-45b2-8efb-e4f506ccc26c"
"47833","dolabrate","shape",,,"Like an axehead oriented cutting edge downward.  This term is not semantically distinct from dolabriform, but botanically they have had somewhat different applications.","shape",NULL,"1","82ade8b3-a656-456b-8eed-63e85b91cbce"
"47834","dolabriform","shape",,,"Elongate, basally terete, becoming strongly compressed toward an abruptly and unilaterally broader apex; like an axe (handle plus head).  This term is not semantically distinct from dolabrate, but botanically they have had somewhat different applications.","shape",NULL,"1","56e00f59-411f-4fd2-b881-9b4690dd2d58"
"47835","dome-shaped","shape",,,"Convex overall, broadest at the base, and transversely more or less circular to elliptical throughout.","shape",NULL,"1","27f28b4c-2443-4115-aaf0-49c4c204e604"
"47836","dorsal","insertion",,"not recommended","On or pertaining to the side or portion of a lateral structure that faces (or would face) away from the bearing axis when (or if) the axis of the lateral structure is (or were) oriented in the same general direction as the bearing axis.","position","q","1","883d19f3-ec78-44d2-9845-82bf15b4250a"
"47837","dorsal","position",,"not recommended","On or pertaining to the side or portion of a lateral structure that faces (or would face) away from the bearing axis when (or if) the axis of the lateral structure is (or were) oriented in the same general direction as the bearing axis.","position","q","1","08d0e3a4-4617-47f4-a86a-23dd9d42f011"
"47838","dorsifixed","fixation",,,"Attached on the abaxial side well above the base.","fixation",NULL,"1","205c3bd6-322b-42a0-8cf0-de42f7bc9cd4"
"47839","dorsiventral","architecture",,,"Having structurally distinct abaxial (dorsal) and adaxial (ventral) portions or aspects.","architecture",NULL,"1","117232dc-4fac-4520-8af2-4cbc71e32640"
"47840","dot","FEATURE",,,"A small, generally round sector of distinct coloration or relief.","FEATURE",NULL,"1","20842891-937c-4d82-8d33-b8b116452aad"
"47841","dot-like","shape",,,"Very small and generally circular in outline.","shape",NULL,"1","b69282fa-70a2-4ae5-a1bd-b0796dc734a6"
"47842","dotted","coloration",,,"Having small, round, clear or colored spots that contrast with the ground color.  See also small-dotted (puncticulate).","coloration",NULL,"1","0e1afb2b-c952-4014-94ef-143a09d46ab8"
"47843","dotted","relief",,,"Having small, round, shallow depressions or low protrusions.  See also small-dotted (puncticulate).","coloration",NULL,"1","8a31118b-b359-4653-afcf-2474077aff8e"
"47844","double_","prefix",,,"Indicating presence of two hierarchical orders of the type of entity or pattern denoted by the term's stem; as in double-pinnate, double-crenate.  See also two-... (bi..., di...).","prefix",NULL,"1","efcb593a-3308-485a-b840-4d3a024aa6d1"
"47845","dovetailing","habit","trichome",,"Papillate and serving to hold a surface to the opposing one of an appressed structure by interlocking with others on the opposing surface; sometimes furcate.","habit",NULL,"1","554f6d66-848e-465c-9382-f039e3de1239"
"47846","downcurved","orientation","lateral structure",,"Salient at its base and then curving downward or backward.","orientation",NULL,"1","97a93643-48e0-404e-a38e-8ae96d2f04ca"
"47847","downy","pubescence",,,"Of or bearing relatively short, slender, soft, more or less erect, capillate trichomes.  See also puberulent.","pubescence",NULL,"1","130781a0-37d0-49e0-ab94-def776ab76c7"
"47848","drooping","orientation",,,"Erect to salient (patent, porrect, spreading) proximally and curving downward distally.","orientation",NULL,"1","b25aa990-2526-46cb-a946-d8c8645e5eec"
"47849","dropper","STRUCTURE",,,"An axial outgrowth that descends from a bulb and eventually forms a new bulb; esp. in Orchidaceae.","STRUCTURE",NULL,"0","016f8c7a-3f12-4d8a-9a8e-7eb8ed1edcc1"
"47850","drupaceous","architecture","fruit",,"Having the structure and texture of a drupe.","architecture",NULL,"1","7854ecbc-e137-4d29-ab57-f76d9026988f"
"47851","drupe","nominative","fruit",,"Fleshy, indehiscent and derived from a single, superior, simple or compound ovary; having a soft outer wall (exocarp and mesocarp) and an osseous inner stone (endocarp) containing the seed(s) (usually only one).","nominative",NULL,"1","b63692b1-b72d-4624-87cd-10c0446d2263"
"47852","drupelet","nominative","fruit",,"Diminutively drupe-like but derived from one of the simple, superior ovaries of an apocarpous flower, having a fleshy fruit wall and a hard seed (pyrene) within, a distinct constituent in an aggregate fruit; esp. in Rosaceae.","nominative",NULL,"1","355c3900-0afb-4b22-b78f-4cf4819a5122"
"47853","dull","reflectance",,,"Reflecting only a low proportion of incident light, with no apparent sheen.","reflectance",NULL,"1","b64b6f66-0be3-4eb6-83f4-588e3e9d0c7b"
"47854","duplicate","arrangement","cotyledons",,"Adaxially contiguous, folded sharply together longitudinally (one adaxially, one abaxially), and reflexed together, one enveloping the hypocotyl and radicle, the other enveloping the first.","arrangement","q","1","35d300ac-2dd6-4823-935f-c7242ebba048"
"47855","duplicate","vernation",,,"Each leaf folded sharply inward along its longitudinal axis, the adaxial surfaces of each side facing one another.","arrangement","q","1","53394187-3219-4866-a4b7-c1caae4f6174"
"47856","duration","CHARACTER",,,"Extent of lifetime, or persistence and physical state after maturation.","CHARACTER",NULL,"1","f86d8d2c-da54-46a5-8f9a-61329dc855f7"
"47857","dusty","coating",,,"Covered with a more or less even deposit of minute, dry, macroscopically indistinguishable particles.  See also powdery (pulverulent), which is not clearly distinct in its application.","coating",NULL,"1","2b367125-0991-4d14-a77c-7228f7ae1976"
"47858","dwarfed","size","plant",,"Strongly reduced; unusually or unexpectedly very small throughout.","size",NULL,"1","9b4d2945-501b-4286-9b2d-bb65870e8c91"
"47859","dyad","STRUCTURE",,,"A pair of coherent pollen grains shed as a unit.","STRUCTURE",NULL,"0","befa6da8-e2dc-4272-8e94-c2aad8b7a474"
"47860","dyadal","arrangement","pollen",,"Cohering and shed in pairs, each tetrad having separated into halves.","arrangement",NULL,"1","e6802a1c-fcb2-4783-97d4-bfc5325eb29f"
"47861","ear","STRUCTURE",,,"A small, rounded, lateral lobe at the base of a laminar structure, lying in more or less the same plane as the remainder of the lamina.","STRUCTURE",NULL,"0","821f1b3a-3fb0-40d9-9f38-ca0a6c0f313c"
"47862","ear-shaped","shape",,,"Resembling a mammalian outer ear.","shape",NULL,"1","df808dba-e6ff-427b-807d-14e1c1459380"
"47863","eared","shape","laminar structure",,"Having two small, rounded, lateral lobes, one to either side, that lie in more or less the same plane as the remainder of the lamina.","shape",NULL,"1","08837eaf-6a7f-4818-8e10-03fac162822a"
"47864","early-maturing","maturation","structure",,"Maturing early in the growing season, or early relative to the developmental progress of its context.","maturation",NULL,"1","11610c87-5056-4d9a-9418-8471797287d7"
"47865","eccentric","position",,,"Having a center or axis of symmetry not coincident with that of the context of reference.","position",NULL,"1","04a8c423-0ef8-44ff-8690-156ea2a93441"
"47866","echinate","architecture",,,"Bearing spines.","architecture",NULL,"1","43b625cb-59d7-4598-9d9d-6419fb81f777"
"47867","egg-shaped","shape",,,"Elongate and wholly convex, widest near a bluntly rounded base and attenuate to a narrower rounded apex; like the lateral outline of a fowl egg.  See also obovate.","shape",NULL,"1","fdd32a87-401e-485c-912d-0e00f83722aa"
"47868","egg-shaped","shape",,,"Transversely circular, broadest near a bluntly rounded base, and convexly attenuate to a narrower rounded apex; like a fowl egg.  See also obovoid.","shape",NULL,"1","e40b16cf-6402-4fd7-bb3d-a4760f461741"
"47869","eglandular","architecture",,,"Lacking glands.","architecture",NULL,"1","1fd296f5-4ea9-4a68-9a28-92b48c1d752c"
"47870","eight_","prefix",,,"Indicating presence of or constitution by eight entities of the type denoted by the term's stem; as in eight-carpelled, eight-flowered, eight-stamened.","prefix",NULL,"1","9828d478-39bf-4595-b94a-f22e76b0a675"
"47871","elaiosome","STRUCTURE",,,"A fleshy outgrowth from the seed coat (testa) that contains a high proportion of oil, usually attracting ants for dispersal.","STRUCTURE",NULL,"0","4628e45f-5104-4635-821f-23ec7095dd9b"
"47872","elaminate","architecture","foliaceous structure",,"Lacking an expanded, more or less planate, distal portion (lamina or blade).","architecture",NULL,"1","edddb6b1-b9b5-4e8d-b17f-322b1ed2b7b2"
"47873","elastic","texture",,,"Resiliently deformable with no loss of structural integrity.","texture",NULL,"1","e7844b2c-f556-4d3c-b66b-01ce0b607f93"
"47874","elastoviscin","SUBSTANCE",,,"A sticky, elastic material, especially that forming the threads that sometimes connect pollen grains.","SUBSTANCE",NULL,"1","e8febcd7-ff3a-425a-8160-8773ce7c8071"
"47875","elater","STRUCTURE",,,"An elongate cell with a helical, hygroscopic thickening in its wall, contained within a sporangium, expanding and contracting with changes in humidity and aiding dispersal of the spores; esp. in Hepaticae.","STRUCTURE",NULL,"0","7e843c71-20bd-4b04-be1c-dcbcb59e12ae"
"47876","elater","STRUCTURE",,,"An elongate, flattened, hygroscopic enation from a spore, straightening upon desiccation and aiding transport by air; esp. in Equisetaceae.","STRUCTURE",NULL,"0","b0ba7994-024d-4dae-9b1c-361d6ae70331"
"47877","eleven_","prefix",,,"Indicating presence of or constitution by eleven entities of the type denoted by the term's stem; as in eleven-carpelled, eleven-leafleted, eleven-stamened.","prefix",NULL,"1","d6b28c02-d6b2-4d53-8216-6da695e03e86"
"47878","ellipsoid","shape",,,"Elliptic in any median longitudinal section; elongate, transversely circular, broadest at the middle, and symmetrically convex-attenuate to rounded ends.  See also oblong.","shape",NULL,"1","d17540b3-abd8-41f0-8a57-0e5e20236f15"
"47879","ellipsoidal","shape",,,"Elliptic in any median longitudinal section; elongate, transversely circular, broadest at the middle, and symmetrically convex-attenuate to rounded ends.  See also oblong.","shape",NULL,"1","f890febc-d841-43f3-9fb8-5685f3186e63"
"47880","elliptic","arrangement","bundle scars",,"Forming an ellipse","shape",NULL,"1","19343855-2d60-4c4a-801e-7a93bc194aeb"
"47881","elliptical","arrangement","bundle scars",,"Forming an ellipse","arrangement",NULL,"1","14df352a-4f18-4791-89c6-353ee2a20d71"
"47882","elliptic","shape",,,"Elongate, widest at the middle, and symmetrically convex-attenuate to rounded ends.  See also oblong.","shape",NULL,"1","aeec0f15-ade9-4db6-9ca6-eb86a88d1f2a"
"47883","elliptical","shape",,,"Elongate, widest at the middle, and symmetrically convex-attenuate to rounded ends.  See also oblong.","shape",NULL,"1","f8558419-4a48-4278-a9b1-6bdc0350c29b"
"47884","elongate","shape",,,"Longer in one dimension than in any other.","shape",NULL,"1","89ecf674-4bf9-499e-97e7-9779480f3bc7"
"47885","elongate","shape",,,"Longer in one dimension than in any other.","shape",NULL,"1","1090e181-9cde-4d0a-9780-0a59d4546393"
"47886","emarginate","shape","laminar structure",,"Having a relatively small, acute, distal sinus.","shape",NULL,"1","79f8eee7-b41f-42b6-ad82-1c0b194f0106"
"47887","emargination","FEATURE",,,"A relatively small, acute sinus at the distal end of a laminar structure.","FEATURE",NULL,"1","a661349a-249e-468d-84b2-5c2c4b141166"
"47888","embryo","STRUCTURE",,,"The rudimentary spermatophyte contained within a viable seed.","STRUCTURE",NULL,"0","9e68beef-133e-406a-8f44-6bcdb9ad7cab"
"47889","embryo sac","STRUCTURE",,,"The multinucleate generative cell of an ovule, within which fertilization and zygote formation occur; resulting from meiotic division of a megaspore mother cell within the nucellus, and thus genetically haploid; its contents generally considered to represent an evolutionarily reduced gametophyte.","STRUCTURE",NULL,"0","40e3932e-54db-4f5b-8560-dc73f0d0fa27"
"47890","embryotega","STRUCTURE",,,"A small, hardened, lid-like portion of the testa (seed coat) at the micropyle of some seeds, detaching at germination.","STRUCTURE",NULL,"0","104f2d34-ac37-454a-8c47-dc232259480b"
"47891","embryotegae","STRUCTURE",,,"A small, hardened, lid-like portion of the testa (seed coat) at the micropyle of some seeds, detaching at germination.","STRUCTURE",NULL,"0","69da03cd-2416-4d44-ab8d-f970e7a35fd8"
"47892","embryotegas","STRUCTURE",,,"A small, hardened, lid-like portion of the testa (seed coat) at the micropyle of some seeds, detaching at germination.","STRUCTURE",NULL,"0","20fd1d70-9685-4035-b04a-1e58be9615d8"
"47893","emergent","location","plant, structure of aquatic plant",,"Rising from beneath the water surface to a point above it.","location",NULL,"1","2dafc7aa-ef3e-4d9d-8ee0-d6b02b94bab8"
"47894","emersed","location","structure of aquatic plant",,"Above the water surface.","location",NULL,"1","f1e6ce45-5321-49b6-a009-4ae192c422bd"
"47895","enation","STRUCTURE",,,"A relatively small outgrowth from an otherwise regular boundary or surface of a larger structure.","STRUCTURE",NULL,"0","4d202549-105e-4431-adbc-a0e1620b78c3"
"47896","endeca_","prefix",,,"Indicating presence of or constitution by eleven entities of the type denoted by the term's stem; as in  endecafoliolate, endecagynous.","prefix",NULL,"1","87177def-f8c9-4ddc-908c-162d66d50dc8"
"47897","endocarp","STRUCTURE",,,"The innermost tissue layer of a pericarp.","STRUCTURE",NULL,"0","c95cb198-c3cd-4ac3-bad5-53558cb42763"
"47898","endophytic","habit",,,"Growing within some portion of another, unrelated, living plant.","habit",NULL,"1","f6cc3ac5-8a9c-4ffa-b475-0d4bf37641d0"
"47899","endosperm","structure",,,"A genetically triploid (3n chromosomes) nutritive tissue in a seed; containing stored carbohydrate and/or oil utilized by the embryo prior to and especially upon germination; derived from fusion of the two polar nuclei (n + n chromosomes) of the embryo sac with a sperm nucleus from the pollen tube (n chromosomes).  See also perisperm.","STRUCTURE / SUBSTANCE",NULL,"1","d2e5b76c-22e1-4b8e-bd38-0d0aeaa0c61f"
"47900","enlarged","size",,,"Unusually or unexpectedly large.","shape",NULL,"1","c971c819-f402-4cac-a353-43fc8dd55ccb"
"47901","ennea_","prefix",,,"Indicating presence of or constitution by nine entities of the type denoted by the term's stem; as in  enneandrous, enneafoliolate, enneastylous.","prefix",NULL,"1","a09b3c03-849b-4509-8d38-24c6fb0fc688"
"47902","ensate","shape",,,"Elongate and moderately slender, broadest at the base and gradually attenuate to a short, more strongly attenuate, acute apex; like the outline of the lateral face of a broadsword blade.","shape",NULL,"1","4ff9b0a3-70e7-4044-8980-f1cf77278f73"
"47903","ensiform","shape",,,"Elongate and moderately slender, strongly compressed, the opposite faces plane, parallel, broadest at the base and gradually attenuate to a short, more strongly attenuate, acute apex; like a broadsword blade.","shape",NULL,"1","cc097baf-fdc2-4857-bf00-5795ffd7b9f7"
"47904","entire","shape",,,"Uninterrupted; not deviating significantly from its general line, thus lacking any localized convexities or concavities.","shape",NULL,"1","7d259bb9-2a9f-4aca-b3aa-615088f5f280"
"47905","entomophilous","reproduction","plant, strobilus, flower",,"Having the pollen normally transported between strobili or flowers by insects.","reproduction",NULL,"1","1e89ab36-86eb-491a-95eb-f25ac95469e7"
"47906","enzymatic","exudation",,,"Secreting a digestive exoenzyme; in carnivorous plants.","exudation",NULL,"1","c297db4c-022f-4350-9d52-1638bb2fcf0a"
"47907","epaleate","architecture","receptacle (torus)",,"Lacking paleae (pales, palets); in Asteraceae (Compositae)","architecture",NULL,"1","b03fa248-7429-412f-a6ff-c658000b4dc9"
"47908","ephemeral","duration","plant",,"Annual with a very short life span; germinating, growing, reproducing, and dying within a brief period of favorable conditions, the entire cycle being completed within a few weeks.","duration",NULL,"1","5599baf0-4a40-4e24-a1c1-ee213761e08f"
"47909","epibracteal","insertion",,,"Upon the bracts, or partially adnate thereto and apparently arising therefrom.","position","q","1","b66322a4-4005-437b-b8c8-01902b75e457"
"47910","epibracteal","position",,,"Upon the bracts, or partially adnate thereto and apparently arising therefrom.","position","q","1","a6fc5a42-a840-4a0d-b41e-41f96cd11685"
"47911","epicalyx","STRUCTURE",,,"A whorl of bracts immediately subtending (beneath or outside) a calyx.","STRUCTURE",NULL,"0","cc86b62f-01e4-4f22-8020-9fb860c3e0ce"
"47912","epicalyces","STRUCTURE",,,"A whorl of bracts immediately subtending (beneath or outside) a calyx.","STRUCTURE",NULL,"0","5c4a0546-9e0d-4c95-b6f9-695f76fc8b98"
"47913","epicarp","STRUCTURE",,,"The outermost tissue layer of a pericarp.","STRUCTURE",NULL,"0","a35cee2d-de36-4610-a5a1-0f548f610e7f"
"47914","epichilium","STRUCTURE",,,"The distal portion of a labellum (lip) that has distinct proximal, distal, and sometimes also central parts; in Orchidaceae.  See also hypochilium, mesochilium.","STRUCTURE",NULL,"0","f7d8477a-5839-4df2-bf9e-52cbd2079ee8"
"47915","epicotyl","STRUCTURE",,,"A distinguishable nascent shoot developed in the embryo in some taxa, consisting of a shoot axis with unexpanded internodes and one or more leaf primordia, being that portion of the embryo above the level of cotyledon insertion; the primordial shoot, when developed by the embryo within a seed; the first bud of a spermatophyte, when developed by an embryo within the seed.  In other taxa the shoot is represented in the embryo only by a quiescent apical meristem at the summit of the embryonic axis.","STRUCTURE",NULL,"0","1d0de4e2-28e9-4639-8eec-55be1b0434d5"
"47916","epidermal cell","STRUCTURE",,,"Any of the unspecialized cells of an epidermis; i.e., any other than stomatal guard cells or cells directly associated with trichomes.  While the latter specialized cells are also properly epidermal cells, they are treated separately for descriptive purposes and, for the sake of convenience, use of the general term is restricted to the unspecialized cells that constitute the bulk of an epidermis.","STRUCTURE",NULL,"0","d621ebd9-d637-4a90-bb74-52f6cb467dc4"
"47917","epidermis","STRUCTURE",,,"The anatomically distinct, outermost, living tissue that encloses and protects the other tissues of a plant organ or part, usually overlaid by an exuded waxy cuticle; resulting from primary growth, disrupted and shed as a consequence of secondary growth if that occurs; consisting mainly of cells not further specialized, otherwise including various types of more specialized cells associated with trichomes and stomates.","STRUCTURE",NULL,"0","aaf58e15-18df-4a3f-88f9-6c5af9ebb6ea"
"47918","epidermides","STRUCTURE",,,"The anatomically distinct, outermost, living tissue that encloses and protects the other tissues of a plant organ or part, usually overlaid by an exuded waxy cuticle; resulting from primary growth, disrupted and shed as a consequence of secondary growth if that occurs; consisting mainly of cells not further specialized, otherwise including various types of more specialized cells associated with trichomes and stomates.","STRUCTURE",NULL,"0","35df04e5-fde5-465e-b79e-ae7d5e1537bb"
