"48599","mealy","texture",,,"Of or bearing minute, relatively stout trichomes that are collectively meal- or flour-like and easily detached.","texture",NULL,"1","65495160-0d1e-4b93-8940-9f1374452dc3"
"48600","mealy","pubescence",,,"Loose, dry, and disintegrating in finely granular pieces like meal or flour.","texture",NULL,"1","308dedd6-6564-4f30-9529-fff67103cf6a"
"48601","medial","insertion",,,"At, upon, or closely ranged about the structural or symmetrical midpoint or axis.","position",NULL,"1","3ae21aff-afdd-4496-95f8-64da2e8aeab2"
"48602","medial","position",,,"At, upon, or closely ranged about the structural or symmetrical midpoint or axis.","position",NULL,"1","e4c75f01-b8f9-4cda-bebc-f978aa97ae61"
"48603","median","insertion",,,"At, upon, or closely ranged about the structural or symmetrical midpoint or axis.","position","q","1","eafcfd87-1a15-4e44-96f6-0a1e41b85984"
"48604","median","position",,,"At, upon, or closely ranged about the structural or symmetrical midpoint or axis.","position","q","1","98a9c723-90cc-48e3-b96f-1bd3f207407d"
"48605","medullose","texture",,,"Loose or spongy internally, denser and firmer externally.","texture",NULL,"1","a85d37a9-41db-479e-a360-79b3cbbf748f"
"48606","megagametophyte","PLANT",,,"A gametophyte whose fertile organs (gametangia) are all archegonia.","PLANT",NULL,"1","840f2d81-14c8-42b5-b646-c0c963acfbdc"
"48607","megaphyll","STRUCTURE",,,"A principal, vegetative shoot organ borne laterally from a stem node; its vascular tissues, if any, continuous with those of the stem; undergoing no significant secondary growth; usually more or less bilaterally symmetrical; comprising a distal, usually laminar blade and/or a proximal stalk (petiole) or sheath; usually a primary site of photosynthesis.","STRUCTURE",NULL,"0","c26c826a-30d6-494e-a2f1-05540465c9fc"
"48608","megaphyllous","architecture","plant",,"Bearing megaphylls.","architecture",NULL,"1","13eedcaa-0da2-4a36-acc3-4855cda930c5"
"48609","megasporangium","STRUCTURE",,,"A sporangium that produces megaspores.","STRUCTURE",NULL,"0","da70408e-c99f-42c6-a6bf-4f8c9de3d53d"
"48610","megasporangia","STRUCTURE",,,"A sporangium that produces megaspores.","STRUCTURE",NULL,"0","39beb98a-e588-4996-8a2d-57c9967dc8ab"
"48611","megaspore","STRUCTURE",,,"A female spore; a spore of the larger of two types produced by the sporophytes of a heterosporous taxon; produced in a megasporangium; giving rise upon germination to a megagametophyte.","STRUCTURE",NULL,"0","c91d751f-04ab-4119-bb93-08ec419e0516"
"48612","megasporocarp","STRUCTURE",,,"A sporocarp that bears only megasporangia.","STRUCTURE",NULL,"0","f34d344d-17cf-4ccd-a53e-98c200476e70"
"48613","megasporophyll","STRUCTURE",,,"A sporophyll that bears only megasporangia and, in Pinophyta, naked ovules that develop subsequently.","STRUCTURE",NULL,"0","2ce3e98c-69db-4e7a-9e29-bbf8ee668471"
"48614","megastrobilus","STRUCTURE",,,"A strobilus (cone) whose fertile organs are all megasporophylls.","STRUCTURE",NULL,"0","65823668-1ae4-47a9-bf43-b24f8a6f0e1e"
"48615","megastrobili","STRUCTURE",,,"A strobilus (cone) whose fertile organs are all megasporophylls.","STRUCTURE",NULL,"0","a116a573-2ca8-4bda-b3e7-d0d89e6e2107"
"48616","membranaceous","texture",,,"Extremely thin, pliable, and fairly tough; like animal membrane.  See also chartaceous (papery, papyraceous), pergamentaceous (parchment-like).","texture",NULL,"1","132e72f8-a77f-4507-9415-752e01f77e3b"
"48617","membrane","STRUCTURE",,,"A relatively thin layer of tissue that covers or separates other, different tissue(s) and/or empty space(s).","STRUCTURE",NULL,"0","b0ad7793-ca00-40d6-9e0c-437e043dc264"
"48618","membranous","texture",,,"Extremely thin, pliable, and fairly tough; like animal membrane.  See also chartaceous (papery, papyraceous), pergamentaceous (parchment-like).","shape",NULL,"1","db709ef3-bd00-4a47-a017-6406855c78b9"
"48619","meniscoid","shape",,,"Relatively thin with opposite, round, broad faces, one convex and one concave (as viewed externally), the circumferential edge angular or rounded; like a meniscus.  See also discoid (disciform), lenticular (biconvex, lens-shaped), patelliform (kneecap-shaped).","shape",NULL,"1","d7fc238b-884e-4424-9a3e-01135f51b633"
"48620","mentum","STRUCTURE",,,"A lateral, often nectariferous protrusion from the proximal portion of a column, opposite the labellum, projecting in front of the rest of the flower; in Orchidaceae.","STRUCTURE",NULL,"0","2afde606-aca5-41ab-8ad4-cd80d4dc398d"
"48621","menta","STRUCTURE",,,"A lateral, often nectariferous protrusion from the proximal portion of a column, opposite the labellum, projecting in front of the rest of the flower; in Orchidaceae.","STRUCTURE",NULL,"0","1d7ed204-94c8-4a0a-a6b2-556862ac92bf"
"48622","mericarp","STRUCTURE",,,"One of the segments of a dehisced schizocarp; usually one-seeded and itself indehiscent.","STRUCTURE",NULL,"0","b7716ed7-a73f-44af-bcbf-1e78885444bd"
"48623","_merous","architecture","compound or compound-complex structure",,"Having the number of equivalent component parts indicated by the prefix (e.g., petals in a corolla), or having different component sets of equivalent parts of that number in each set (e.g., calyx and corolla in a perianth); as in monomerous, oligomerous, polymerous, tetramerous, trimerous.","architecture",NULL,"1","6816eb7b-05e7-40fe-8598-564e9ec96ab6"
"48624","mesocarp","STRUCTURE",,,"The middle tissue layer of the pericarp of a fruit.","STRUCTURE",NULL,"0","f00ffde0-ba8e-4ff7-9659-4170fc3b4332"
"48625","mesochilium","STRUCTURE",,,"The central portion of a labellum (lip) that has distinct proximal, distal, and central parts; in Orchidaceae.  See also epichilium, hypochilium.","STRUCTURE",NULL,"0","d6237960-1e0e-4c40-943a-49b999eeac8b"
"48626","microgametophyte","PLANT",,,"A gametophyte whose fertile organs (gametangia) are all antheridia.","PLANT",NULL,"1","75acdf19-90ff-4e85-86c0-1d41b6031a57"
"48627","microphyll","STRUCTURE",,,"A small, lateral, leaf-like enation that, evolutionarily, is not a true leaf, i.e., whose vasculature, if any, consists of only a single median strand not ontogenetically integral with the vasculature of the bearing stem and not associated with leaf gaps in the stele of the stem; in Bryophyta, Psilotophyta, Lycopodiophyta, Equisetophyta.","STRUCTURE",NULL,"0","f5132d85-d6bb-4a70-8442-cbf2b605023d"
"48628","microphyllous","architecture","plant",,"Bearing microphylls.","architecture",NULL,"1","a4534c52-79be-47ac-bf00-03caa023fdae"
"48629","micropyle","FEATURE",,,"The small pore in the integuments of an ovule at its apex, through which the pollen tube grows; or the corresponding aperture or scar in the coat of the seed that develops subsequently.","FEATURE",NULL,"1","bdeac71b-b77a-4558-8008-fcb5247508ff"
"48630","microsporangium","STRUCTURE",,,"A sporangium that produces microspores.","STRUCTURE",NULL,"0","81a13c43-469f-4abf-ae84-a2e758b71fa3"
"48631","microsporangia","STRUCTURE",,,"A sporangium that produces microspores.","STRUCTURE",NULL,"0","067d82bc-0218-4f34-b021-f1c3acadd136"
"48632","microspore","STRUCTURE",,,"A male spore; a spore of the smaller of the two types produced by the sporophytes of a heterosporous taxon; produced in a microsporangium; giving rise upon germination to a microgametophyte.","STRUCTURE",NULL,"0","9037b0e8-67e4-437d-a207-420405a07d9d"
"48633","microsporocarp","STRUCTURE",,,"A sporocarp that bears only microsporangia.","STRUCTURE",NULL,"0","bb985e59-bdaf-4e44-b8a5-af7033e6b5c9"
"48634","microsporophyll","STRUCTURE",,,"A sporophyll that bears only microsporangia.","STRUCTURE",NULL,"0","7ce33409-90c4-432b-90ac-babf812fe0ce"
"48635","microstrobilus","STRUCTURE",,,"A strobilus (cone) whose fertile organs are all microsporophylls.","STRUCTURE",NULL,"0","ebda7bb0-bb12-4160-bbc6-a5edc4fb316c"
"48636","midnerve","STRUCTURE",,,"A primary vein that runs longitudinally through the center of a leaf or other basically laminar structure.  See also lateral vein, secondary vein, tertiary vein, veinlet.","STRUCTURE",NULL,"0","30c40ba8-2c25-4f78-9905-27d5c4ecf8bc"
"48637","midrib","STRUCTURE",,,"A primary vein that runs longitudinally through the center of a leaf or other basically laminar structure.  See also lateral vein, secondary vein, tertiary vein, veinlet.","STRUCTURE",NULL,"0","202c0000-3b32-450c-9cf5-cbbf7e8a0d8d"
"48638","midvein","STRUCTURE",,,"A primary vein that runs longitudinally through the center of a leaf or other basically laminar structure.  See also lateral vein, secondary vein, tertiary vein, veinlet.","STRUCTURE",NULL,"0","006a1819-4411-4fec-a932-86d4d8e40c98"
"48639","mitre-shaped","shape",,,"Broadest and transversely round to oval proximally, tapering bilaterally above the middle to a central peak; like a peaked hat or cap.","shape",NULL,"1","55ba259b-e4f1-4deb-9cdb-ab4f59afed6b"
"48640","mitriform","shape",,,"Broadest and transversely round to oval proximally, tapering bilaterally above the middle to a central peak; like a peaked hat or cap.","shape",NULL,"1","50c87832-8cfc-470c-a525-05bd50cb198c"
"48641","mixed-craspedodromous","venation",,,"Having a midvein that branches to either side along the length of the lamina, the secondary veins running thence toward the margin, some becoming indistinct before reaching it, others terminating there.","venation",NULL,"1","4a3d4c89-665f-4cc4-8984-a389110fdddf"
"48642","monadal","arrangement","pollen",,"Shed singly, or essentially so, only loosely and irregularly, if at all, coherent, each original tetrad having separated fully.","arrangement",NULL,"1","7a896d94-0b79-40a8-b7a6-9b8b9fae9f26"
"48643","moniliform","shape",,,"Elongate, relatively slender, transversely round, and more or less regularly constricted over its length, the whole straight or variously curved; like a necklace of beads.","shape",NULL,"1","37cf8f8f-8494-4913-be45-14a929e64549"
"48644","mono_","prefix",,,"Indicating presence of or constitution by one entity of the type denoted by the term's stem; as in  monandrous, monocolpate, monocyclic.  See also entries for particular terms with this prefix whose meanings, at least in some applications, are more specific than usually indicated by such combination.","prefix",NULL,"1","3f935c11-6c0e-4ffd-b03f-81508d41d095"
"48645","monocarpic","reproduction","plant",,"Normally reproducing sexually only once, then promptly senescent.","reproduction",NULL,"1","5355f3e9-008e-4ee2-9c07-f74d80dffb3b"
"48646","monochasiate","architecture","inflorescence",,"Comprising one or more simple or compound monochasia.  See also cincinnate, cymose, cymulose, dichasiate, helicoid-cymose, scorpioid-cymose.","architecture",NULL,"1","b2eecc4f-405d-403c-9788-1960f3d0a9eb"
"48647","monochasiform","architecture","capitulescence, inflorescence",,"Resembling a monochasium, but not strictly such.","architecture",NULL,"1","bd2c2ea4-1511-479e-9c79-d567a3d2d6d6"
"48648","monochasium","nominative","inflorescence",,"Determinate and falsely dichotomous with each axial segment bearing a single, sessile terminal flower; presumably derived from a dichasium by loss of the lateral flowers.  See also cincinnus, cyme, cymule, dichasium, helicoid cyme, scorpioid cyme.","nominative",NULL,"1","ef098a30-8390-46b6-bf5a-3cce983dda47"
"48649","monochasia","nominative","inflorescence",,"Determinate and falsely dichotomous with each axial segment bearing a single, sessile terminal flower; presumably derived from a dichasium by loss of the lateral flowers.  See also cincinnus, cyme, cymule, dichasium, helicoid cyme, scorpioid cyme.","nominative",NULL,"1","317b9221-6452-4027-ba2c-cdbe8cc7cb0d"
"48650","monochasium-like","architecture","capitulescence, inflorescence",,"Resembling a monochasium, but not strictly such.","architecture",NULL,"1","1a7ad5ec-a87d-441a-ba68-23aaef288dcf"
"48651","monochlamydeous","architecture","flower",,"Having a monocyclic perianth.","architecture",NULL,"1","d67d17a8-1c43-439b-b5da-b3a0ddb32e14"
"48652","monoclinous","reproduction","taxon",,"Having all flowers functionally bisexual; this condition is implied by default if no other is specified.  See also diclinous.","reproduction",NULL,"1","1bef1a27-36d6-483f-801e-51e655bd697a"
"48653","monoecious","reproduction","taxon",,"Having all flowers or spikelets functionally unisexual, and all plants having both staminate and pistillate types.  See also dioecious.","reproduction",NULL,"1","e9cd8c32-83e1-4003-b4f0-109ea5a6c1c3"
"48654","monolete","architecture","spore",,"Having a single linear tetrad scar (surficial ridge or angle resulting from ontogenetic coherence with others produced from the same spore mother cell).","architecture",NULL,"1","b42a80c4-e917-4e29-8d43-e962ca77682f"
"48655","monopodial","architecture","axes",,"Branching laterally, each axis of each order of branches produced by a single, persistently dominant, apical meristem.  See also sympodial.","architecture",NULL,"1","84e0b4e0-1fbd-4a88-b878-6ed9a69b717d"
"48656","_morphic","architecture",,,"Existing within the taxon in the number of distinct structural states indicated by the prefix, the states segregated in different sets of plants or not; as in monomorphic, polymorphic, trimorphic.","architecture",NULL,"1","a4b4bab3-bd85-4757-879f-b2fea93b328c"
"48657","motile","habit",,,"Able to translocate by intrinsic means, as by flagellar propulsion.","habit",NULL,"1","4d51fac3-d77e-4a11-8453-4ba96606033d"
"48658","mottled","coloration",,,"Having one or more indistinctly delineated, irregularly shaped, areas of varying size and contrasting hue and/or intensity.","coloration",NULL,"1","80c1d776-a299-4dba-b44a-e578d6f20b01"
"48659","mound-shaped","shape",,,"Essentially round in transverse section, much broader than long or high, with a convex distal face that intersects either a more or less plane proximal face or, when the structure is sessile, its bearing surface.","shape",NULL,"1","7dfabed5-a343-496e-aa5c-b06b7d73d5e3"
"48660","mucilage","substance",,,"A slimy exudate.","substance",NULL,"1","2e237381-ac50-440b-99f2-eb4179755518"
"48661","mucilaginous","coating",,,"Of a slimy substance, or becoming so upon wetting.","coating","q","1","970739c2-f097-4e0c-a822-8d46d13d8076"
"48662","mucilaginous","texture",,,"Slimy.","coating","q","1","7b11b57e-852d-4ee0-864c-7aab5ffed472"
"48663","mucous","coating",,,"Of a slimy substance, or becoming so upon wetting.","coating","q","1","7a779089-bb39-4d9c-9e8b-d585d6a38bc1"
"48664","mucous","texture",,,"Slimy.","coating","q","1","10ad7138-a91b-409b-826d-0e5fa5b04f3f"
"48665","mucro","STRUCTURE",,,"A short, hard, apical point that is a continuation of vascular tissue.  See also apiculum.","STRUCTURE",NULL,"0","c8fdc1f2-3fb0-4519-ba0b-e8d41d8ea5b6"
"48666","mucrones","STRUCTURE",,,"A short, hard, apical point that is a continuation of vascular tissue.  See also apiculum.","STRUCTURE",NULL,"0","91dcf567-53c8-4d06-8425-7058bf2aedf6"
"48667","mucros","STRUCTURE",,,"A short, hard, apical point that is a continuation of vascular tissue.  See also apiculum.","STRUCTURE",NULL,"0","a9869109-7f62-4aff-828a-b69fe3770fcd"
"48668","mucronate","shape",,,"Terminating abruptly in a short, hard point that is a continuation of vascular tissue.  See also apiculate, mucronulate.","shape",NULL,"1","2b0b55f4-3d8d-44d8-ad15-b3e6e93d906b"
"48669","mucronulate","shape",,,"Finely mucronate.  See also apiculate.","shape",NULL,"1","f70365f8-d81d-4028-8501-c06f88821b10"
"48670","multi_","prefix",,,"Indicating presence of or constitution by a relatively large number of entities of the type denoted by the term's stem; as in  multicarpellate, multicellular, multifacial, multiseriate.  See also oligo... (few-...).","prefix",NULL,"1","d4801271-9556-4716-9507-d97c241cee67"
"48671","multiciliate","architecture",,,"Having several to many cilia.","architecture",NULL,"1","553821b5-334b-4a93-bb69-c733a1a7af01"
"48672","multicipital","architecture","plant",,"Having many, more or less equal, principal stems arising at substrate level from a caudex or root crown.","architecture",NULL,"1","86ad5af7-8561-47a2-a898-2ca44201067e"
"48673","multiple fruit","nominative","fruit",,"Compound and derived from the connate or coherent ovaries and accessory tissue(s), if any, of two or more adjacent flowers.","nominative",NULL,"1","bf3f5da4-5b0b-4fa7-a8cd-112f4c8b06f8"
"48674","muricate","relief",,,"Having short, hard, more or less acute, transversely round protrusions overall.  See also muriculate.","relief",NULL,"1","b6b0ecc0-5de5-47a2-80a9-d7a42534a27a"
"48675","muriculate","relief",,,"Finely muricate.","relief",NULL,"1","538c03f2-5c5b-47ab-a8d9-691bfaf38a06"
"48676","muriform","arrangement","cells",,"Disposed like bricks in a wall; in parallel rows, the members in each row overlapping the boundaries between members of the adjacent rows.","arrangement",NULL,"1","52a6a903-9965-4373-bd6b-7dcba3000760"
"48677","muscariform","shape",,,"Having a proximal axis that bears a distal cluster of elongate slender branches or appendages, these variously ascending to erect; like a broom.","shape",NULL,"1","9bcb275d-8a45-42b0-804a-452cf5e62198"
"48678","mushroom-shaped","shape",,,"Having a cylindric base and a considerably broader, pulvinate distal portion; like the generalized form of a mushroom.","shape",NULL,"1","f81501fa-330e-4744-8795-a99f318e9001"
"48679","muticous","shape",,,"Lacking a distinct terminal point (when one might be expected).","shape",NULL,"1","5e0a94fd-f1d5-455c-b33b-dc152c2fbba8"
"48680","naked","architecture",,,"Lacking a covering that might have been expected.","architecture",NULL,"1","c58612cc-cae0-4b5c-9309-3587e7bbb12f"
"48681","naked","architecture","bud",,"Lacking enclosing protective scales, the outermost embryonic components exposed and not differing significantly from those within.  See also perulate.","architecture",NULL,"1","89a50840-ee9c-4ddc-8965-2559c2fa9559"
"48682","naked","architecture","flower",,"Lacking a perianth.","architecture",NULL,"1","c72ac3c7-57be-4f10-b7e0-d217781eec22"
"48683","naked","architecture","receptacle (torus)",,"Lacking paleae; in Asteraceae (Compositae)","architecture",NULL,"1","1ecfcbd4-9845-41e3-88ce-b7e1d2a1d266"
"48684","napiform","shape",,,"Depressed-globose overall and strongly acuminate (concave-tapered) at the base; like the generalized form of a turnip.","shape",NULL,"1","923651ac-b3e7-4481-b60c-80fb40ecf9e0"
"48685","navicular","shape",,,"Like the generalized form of a boat hull, the walls relatively thin to moderately thick, the interior essentially empty and open along one side.","shape",NULL,"1","b7b731ea-65e9-4596-a12c-113b30def4a2"
"48686","near-bald","pubescence",,,"Nearly glabrous, with only a very sparse covering of trichomes.","pubescence",NULL,"1","f3cabee2-d942-462e-8931-8bb8229beeec"
"48687","neck","STRUCTURE","archegonial",,"The distal narrowed portion of an archegonium above its bulbous base.","STRUCTURE",NULL,"0","dc635dfe-494e-494f-9e80-0280dbdbf64f"
"48688","neck","STRUCTURE","floral tube",,"The solid, usually constricted portion of a floral tube sometimes present between casing and collar when those are both present.","STRUCTURE",NULL,"0","bca42d74-d8c4-4052-98fe-24d1df56e4f5"
"48689","nectar","SUBSTANCE",,,"An aqueous exudate of high sugar content.","SUBSTANCE",NULL,"1","f349e1ef-e049-4167-8a7f-263bba209c27"
"48690","nectariferous","exudation",,,"Producing and secreting nectar; when glands are nectariferous, they are usually indicated nominatively as nectaries.","exudation",NULL,"1","3528fd87-9eeb-447a-8802-581fb6677c2e"
"48691","nectary","STRUCTURE",,,"A multicellular, anatomically distinct structure that produces and exudes nectar.","STRUCTURE",NULL,"0","fb238672-192a-42ef-abbb-47d7956b6b37"
"48692","needle","STRUCTURE",,,"A relatively stiff, compressed-acerose leaf; in Pinophyta.","STRUCTURE",NULL,"0","0b9a2187-17e3-48d3-a8f1-afd7cc6a326e"
"48693","needle-shaped","shape",,,"Rounded in cross-section and very slenderly elongate, broadest near the middle, and gradually attenuate to an acute apex and a slightly blunter base.","shape",NULL,"1","9890d025-37f2-43ad-b9c6-8104c158a97e"
"48694","neotenous","maturation","structure",,"Retaining at maturity attributes that are usually restricted to the juvenile stage.","maturation",NULL,"1","b0807ff7-7bea-4b71-b5df-da903a049634"
"48695","nerve","STRUCTURE",,,"A strand belonging to any except the ultimate (least in diameter) order of vasculature in a leaf or other foliaceous structure.  See also lateral vein, primary vein, secondary vein, tertiary vein, veinlet.","STRUCTURE",NULL,"0","68570d4e-1ba0-4dbb-8837-49ea28b17999"
"48696","net-like","architecture","tertiary and higher-order laminar veins, excl veinlets",,"Interconnecting more or less regularly.","architecture",NULL,"1","692ba3f1-35f7-47cc-bd6a-e85eca7a67cb"
"48697","netted","architecture","tertiary and higher-order laminar veins, excl veinlets",,"Interconnecting more or less regularly.","architecture","q","1","b7747673-2f54-4e78-8ea5-827feb55f087"
"48698","netted","coloration",,,"Having a pattern of interconnected fine lines of contrasting hue and/or intensity.","architecture","q","1","fccefe3f-8664-4fd6-a828-807750a658f4"
"48699","netted","relief",,,"Having prominulous, more or less regularly interconnected lines.","architecture","q","1","5ecfa606-c1a2-4d31-8d69-b4dd22d52389"
"48700","neuter","architecture","flower, floret",,"Lacking both stamens and pistils.","architecture",NULL,"1","90eab595-b3c1-4365-a183-de0c9ed03d0c"
"48701","night-blooming","habit","flower",,"Opening during the nighttime.","habit",NULL,"1","54f8bd9b-9dab-4a95-8d3e-d0432775b755"
"48702","nine_","prefix",,,"Indicating presence of or constitution by nine entities of the type denoted by the term's stem; as in nine-carpelled, nine-loculed, nine-tepaled.","prefix",NULL,"1","86633ce6-d827-4593-8080-84938b460f36"
"48703","nocturnal","habit","flower",,"Opening during the nighttime.","habit",NULL,"1","080385a8-05dd-4383-a2e0-cbf5666ec534"
"48704","nodal","insertion",,,"Upon or associated with the nodes.","position","q","1","b2c522cf-c552-4e1d-bb2d-ddd0772fc8cb"
"48705","nodal","position",,,"Upon or associated with the nodes.","position","q","1","dea99484-01c2-4cee-bd30-e3a001d0cf1a"
"48706","nodding","orientation","stalked structure",,"Having the stalk proximally erect and distally recurved, the main body thus oriented outward to downward.  See also hanging (pendent, pendulous).","orientation",NULL,"1","23ae14a6-c3af-4f8a-b82a-4f1b270e0c77"
"48707","node","STRUCTURE",,,"One of the evident sectors of a stem that occur sequentially along its length and from which leaves (megaphylls) and lateral branches arise exogenously.  The anatomy of nodes differs from, but is not abruptly distinct longitudinally from, that of the intervening sectors (internodes), with which it is smoothly confluent and from which is distinguished by the lateral transit and egress of vascular traces interconnecting the stem and the leaves and branches that it bears.","STRUCTURE",NULL,"0","0464578f-f6c5-4093-911a-c6784dafa420"
"48708","nodiform","shape",,,"Approximately globose, the surface convoluted or not, like a knob or knot; usually applied only to structures or components that are relatively small.","shape",NULL,"1","07fce17a-c8d6-4004-9315-84aff3b5507c"
"48709","nodose","shape",,,"Having nodiform (gongylodate, gongyloid, knob-shaped, knot-shaped) protrusions.  See also nodulose.","shape",NULL,"1","e312078a-a29b-4dfa-b8f6-5e2b69baf26d"
"48710","nodule","STRUCTURE",,,"A small nodiform (gongylodate, gongyloid, knob-shaped, knot-shaped) segment or protrusion; esp. in roots of Fabaceae (Leguminosae) and harboring nitrogen-fixing bacteria.","STRUCTURE",NULL,"0","b62e2f23-dffc-474a-a7bd-f919ea99b51c"
"48711","nodulose","shape",,,"Diminutively nodose; esp. roots of Fabaceae (Leguminosae), the nodules harboring nitrogen-fixing bacteria.","shape",NULL,"1","df20c79c-6775-4d9f-9905-8c81383f4e7a"
"48712","non-porous","porosity",,,"Lacking vessels, the tracheary elements limited to tracheids and, sometimes, fiber-tracheids.","porosity",NULL,"1","19001d39-c317-498e-9e33-2f0fc539f62a"
"48713","non-septate","architecture","trichome",,"Lacking transverse inter- or intracellular septa or partitions.","architecture",NULL,"1","433b03c2-52dc-48c2-ae57-421401e8423b"
"48714","non-stomate-bearing","architecture",,,"Lacking stomates in the epidermis.","architecture",NULL,"1","c12e8844-6879-4dcb-9c19-11b77e5361ff"
"48715","notch","FEATURE",,,"A relatively small, acute sinus at the distal end of a laminar structure.","FEATURE",NULL,"1","780b5694-42ea-4fbe-bf71-268e020604a5"
"48716","notched","shape","laminar structure",,"Having a relatively small, acute, distal sinus.","shape",NULL,"1","2c1c7655-9c7f-440b-b8e0-634488803a20"
"48717","notorhizal","arrangement","cotyledons",,"Adaxially contiguous and reflexed parallel to the hypocotyl and radicle, the abaxial surface of one lying against them.","arrangement",NULL,"1","5bfa31a4-9b1f-4ad9-a733-4767f6c41c87"
"48718","nucellus","STRUCTURE",,,"The distinct, genetically diploid tissue layer immediately surrounding the embryo sac of an ovule; often considered equivalent to a megasporangium wall.","STRUCTURE",NULL,"0","f915e383-e861-4dae-9cea-8e926e1fc64b"
"48719","nucelli","STRUCTURE",,,"The distinct, genetically diploid tissue layer immediately surrounding the embryo sac of an ovule; often considered equivalent to a megasporangium wall.","STRUCTURE",NULL,"0","6ba590f7-80b0-4cf1-a378-a8e1286b7d18"
"48720","nut","nominative","fruit",,"Relatively large, indehiscent, one-loculed, one-seeded and with a thick, hard, sometimes osseous pericarp; derived from a single, simple or compound ovary.  See also acorn (glans).","nominative",NULL,"1","134f4334-92d1-4d0b-b334-59b911bb09b5"
